Title,Year,Rated,Runtime,Genre,Lead_1,Lead_1_Male,Lead_2,Lead_2_Male,Plot,Poster,Metascore,imdbID,BoxOffice
Harry Potter and the Deathly Hallows: Part 2,2011,PG-13,130,Adventure,Daniel Radcliffe,TRUE,Emma Watson,FALSE,"Harry, Ron, and Hermione continue their quest of finding and destroying the Dark Lord's three remaining Horcruxes, the magical items responsible for his immortality. But as the mystical Deathly Hallows are uncovered, and Voldemort finds out about their mission, the biggest battle begins and life as they know it will never be the same again.",https://ia.media-imdb.com/images/M/MV5BMjIyZGU4YzUtNDkzYi00ZDRhLTljYzctYTMxMDQ4M2E0Y2YxXkEyXkFqcGdeQXVyNTIzOTk5ODM@._V1_SX300.jpg,87,tt1201607,381000185
Transformers: Dark of the Moon,2011,PG-13,154,Action,Shia LaBeouf,TRUE,Rosie Huntington-Whiteley,FALSE,"Autobots Bumblebee, Ratchet, Ironhide, Mirage (aka Dino), Wheeljack (aka Que) and Sideswipe led by Optimus Prime, are back in action taking on the evil Decepticons, who are eager to avenge their recent defeat. The Autobots and Decepticons become involved in a perilous space race between the United States and Russia to reach a hidden Cybertronian spacecraft on the moon and learn its secrets, and once again Sam Witwicky has to go to the aid of his robot friends. The new villain Shockwave is on the scene while the Autobots and Decepticons continue to battle it out on Earth.",https://images-na.ssl-images-amazon.com/images/M/MV5BMTkwOTY0MTc1NV5BMl5BanBnXkFtZTcwMDQwNjA2NQ@@._V1_SX300.jpg,42,tt1399103,352358779
The Twilight Saga: Breaking Dawn - Part 1,2011,PG-13,117,Adventure,Kristen Stewart,FALSE,Robert Pattinson,TRUE,"After Bella and Edward's honeymoon, things take a turn for the worse when Bella realises she is pregnant. The baby grows at an abnormally fast rate and causes many health problems to Bella. The wolf pack see the unborn child as a threat and plan to get rid of it. But the Cullens do everything they can to ensure that both Bella and the unborn child remain safe.",https://images-na.ssl-images-amazon.com/images/M/MV5BODgxNDE0OTAzOF5BMl5BanBnXkFtZTcwNzcwODE2Ng@@._V1_SX300.jpg,45,tt1324999,281267663
The Hangover Part II,2011,R,102,Comedy,Bradley Cooper,TRUE,Zach Galifianakis,TRUE,"Stu is getting married. Along with Doug, Phil, and his soon-to-be brother-in-law Teddy, he regretfully invites Alan to Thailand for the wedding. After a quiet night on the beach with a beer and toasting marshmallows by the camp fire, Stu, Alan and Phil wake up in a seedy apartment in Bangkok. Doug is back at the resort, but Teddy is missing, there's a monkey with a severed finger, Alan's head is shaved, Stu has a tattoo on his face, and they can't remember any of it. The wolf-pack retrace their steps through strip clubs, tattoo parlors and cocaine-dealing monkeys on the streets of Bangkok as they try and find Teddy before the wedding.",https://ia.media-imdb.com/images/M/MV5BMTM2MTM4MzY2OV5BMl5BanBnXkFtZTcwNjQ3NzI4NA@@._V1_SX300.jpg,44,tt1411697,254400000
Pirates of the Caribbean: On Stranger Tides,2011,PG-13,136,Action,Johnny Depp,TRUE,Penélope Cruz,FALSE,"Captain Jack Sparrow (Depp) crosses paths with a woman from his past (Cruz), and he's not sure if it's love -- or if she's a ruthless con artist who's using him to find the fabled Fountain of Youth. When she forces him aboard the Queen Anne's Revenge, the ship of the formidable pirate Blackbeard (McShane), Jack finds himself on an unexpected adventure in which he doesn't know who to fear more: Blackbeard or the woman from his past.",https://ia.media-imdb.com/images/M/MV5BMjE5MjkwODI3Nl5BMl5BanBnXkFtZTcwNjcwMDk4NA@@._V1_SX300.jpg,45,tt1298650,241063875
Fast Five,2011,PG-13,130,Action,Vin Diesel,TRUE,Paul Walker,TRUE,"Former cop Brian O'Conner partners with ex-con Dom Toretto on the opposite side of the law. Since Brian and Mia Toretto broke Dom out of custody, they've blown across many borders to elude authorities. Now backed into a corner in Rio de Janeiro, they must pull one last job in order to gain their freedom. As they assemble their elite team of top racers, the unlikely allies know their only shot of getting out for good means confronting the corrupt businessman who wants them dead. But he's not the only one on their tail. Hard-nosed federal agent Luke Hobbs never misses his target. When he is assigned to track down Dom and Brian, he and his strike team launch an all-out assault to capture them. But as his men tear through Brazil, Hobbs learns he can't separate the good guys from the bad. Now, he must rely on his instincts to corner his prey... before someone else runs them down first.",https://images-na.ssl-images-amazon.com/images/M/MV5BMTUxNTk5MTE0OF5BMl5BanBnXkFtZTcwMjA2NzY3NA@@._V1_SX300.jpg,66,tt1596343,209805005
Mission: Impossible - Ghost Protocol,2011,PG-13,132,Action,Tom Cruise,TRUE,Jeremy Renner,TRUE,"In the fourth installment of the Mission Impossible series, Ethan Hunt and a new team race against time to track down Hendricks, a dangerous terrorist who has gained access to Russian nuclear launch codes and is planning a strike on the United States. An attempt by the team to stop him at the Kremlin ends in a disaster, with an explosion causing severe damage to the Kremlin and the IMF being implicated in the bombing, forcing the President to invoke Ghost Protocol, under which the IMF is disavowed, and will be offered no help or backup in any form. Undaunted, Ethan and his team chase Hendricks to Dubai, and from there to Mumbai, but several spectacular action sequences later, they might still be too late to stop a disaster.",https://ia.media-imdb.com/images/M/MV5BMTY4MTUxMjQ5OV5BMl5BanBnXkFtZTcwNTUyMzg5Ng@@._V1_SX300.jpg,73,tt1229238,209364921
Cars 2,2011,G,106,Animation,Owen Wilson,TRUE,Larry the Cable Guy,TRUE,"The famous race car Lightning McQueen and his team are invited to compete in the World Grand Prix race. There, McQueen's best friend Mater, finds himself involved in international espionage, and alongside two professional British spies, attempts to uncover a secret plan led by a mysterious mastermind and his criminal gang, which threatens the lives of all competitors in the tournament.",https://images-na.ssl-images-amazon.com/images/M/MV5BMTUzNTc3MTU3M15BMl5BanBnXkFtZTcwMzIxNTc3NA@@._V1_SX300.jpg,57,tt1216475,191450875
Sherlock Holmes: A Game of Shadows,2011,PG-13,129,Action,Robert Downey Jr.,TRUE,Jude Law,TRUE,"Sherlock Holmes (Robert Downey Jr.) and his longtime trusted associate, Doctor Watson (Jude Law), take on their arch-nemesis, Professor Moriarty (Jared Harris), with the help of Holmes' older brother Mycroft Holmes (Stephen Fry) and a gypsy named Simza (Noomi Rapace).",https://ia.media-imdb.com/images/M/MV5BMTQwMzQ5Njk1MF5BMl5BanBnXkFtZTcwNjIxNzIxNw@@._V1_SX300.jpg,48,tt1515091,186830669
Thor,2011,PG-13,115,Action,Chris Hemsworth,TRUE,Anthony Hopkins,TRUE,"The warrior Thor (Hemsworth) is cast out of the fantastic realm of Asgard by his father Odin (Hopkins) for his arrogance and sent to Earth to live among humans. Falling in love with scientist Jane Foster (Portman) teaches Thor much-needed lessons, and his new-found strength comes into play as a villain from his homeland sends dark forces toward Earth.",https://ia.media-imdb.com/images/M/MV5BOGE4NzU1YTAtNzA3Mi00ZTA2LTg2YmYtMDJmMThiMjlkYjg2XkEyXkFqcGdeQXVyNTgzMDMzMTg@._V1_SX300.jpg,57,tt0800369,181015141
Rise of the Planet of the Apes,2011,PG-13,105,Action,James Franco,TRUE,Andy Serkis,TRUE,"At the story's heart is Caesar (Andy Serkis), a chimpanzee who gains human-like intelligence and emotions from an experimental drug. Raised like a child by the drug's creator, Will Rodman (James Franco) and a primatologist Caroline Aranha (Freida Pinto), Caesar ultimately finds himself taken from the humans he loves and imprisoned in an ape sanctuary in San Bruno. Seeking justice for his fellow inmates, Caesar gives the fellow apes the same drug that he inherited. He then assembles a simian army and escapes the sanctuary - putting man and ape on a collision course that could change the planet forever.",https://images-na.ssl-images-amazon.com/images/M/MV5BYzE3ZmNlZTctMDdmNy00MjMzLWFmZmYtN2M5N2YyYTQ1ZDJjXkEyXkFqcGdeQXVyNTAyODkwOQ@@._V1_SX300.jpg,68,tt1318514,175300000
Captain America: The First Avenger,2011,PG-13,124,Action,Chris Evans,TRUE,Hugo Weaving,TRUE,"It is 1942, America has entered World War II, and sickly but determined Steve Rogers is frustrated at being rejected yet again for military service. Everything changes when Dr. Erskine recruits him for the secret Project Rebirth. Proving his extraordinary courage, wits and conscience, Rogers undergoes the experiment and his weak body is suddenly enhanced into the maximum human potential. When Dr. Erskine is then immediately assassinated by an agent of Nazi Germany's secret HYDRA research department (headed by Johann Schmidt, a.k.a. the Red Skull), Rogers is left as a unique man who is initially misused as a propaganda mascot; however, when his comrades need him, Rogers goes on a successful adventure that truly makes him Captain America, and his war against Schmidt begins.",https://ia.media-imdb.com/images/M/MV5BMTYzOTc2NzU3N15BMl5BanBnXkFtZTcwNjY3MDE3NQ@@._V1_SX300.jpg,66,tt0458339,176636816
The Help,2011,PG-13,146,Drama,Emma Stone,FALSE,Viola Davis,FALSE,"Set in Mississippi during the 1960s, Skeeter (Stone) is a southern society girl who returns from college determined to become a writer, but turns her friends' lives -- and a Mississippi town -- upside down when she decides to interview the black women who have spent their lives taking care of prominent southern families. Aibileen (Davis), Skeeter's best friend's housekeeper, is the first to open up -- to the dismay of her friends in the tight-knit black community. Despite Skeeter's life-long friendships hanging in the balance, she and Aibileen continue their collaboration and soon more women come forward to tell their stories -- and as it turns out, they have a lot to say. Along the way, unlikely friendships are forged and a new sisterhood emerges, but not before everyone in town has a thing or two to say themselves when they become unwittingly -- and unwillingly -- caught up in the changing times.",https://ia.media-imdb.com/images/M/MV5BMTM5OTMyMjIxOV5BMl5BanBnXkFtZTcwNzU4MjIwNQ@@._V1_SX300.jpg,62,tt1454029,169705587
Bridesmaids,2011,R,125,Comedy,Kristen Wiig,FALSE,Maya Rudolph,FALSE,"Annie (Kristen Wiig), is a maid of honor whose life unravels as she leads her best friend, Lillian (Maya Rudolph), and a group of colorful bridesmaids (Rose Byrne, Melissa McCarthy, Wendi McLendon-Covey and Ellie Kemper) on a wild ride down the road to matrimony. Annie's life is a mess. But when she finds out her lifetime best friend is engaged, she simply must serve as Lillian's maid of honor. Though lovelorn and broke, Annie bluffs her way through the expensive and bizarre rituals. With one chance to get it perfect, she'll show Lillian and her bridesmaids just how far you'll go for someone you love.",https://images-na.ssl-images-amazon.com/images/M/MV5BMjAyOTMyMzUxNl5BMl5BanBnXkFtZTcwODI4MzE0NA@@._V1_SX300.jpg,75,tt1478338,166500000
Kung Fu Panda 2,2011,PG,90,Animation,Jack Black,TRUE,Angelina Jolie,FALSE,"In the Valley of Peace, Po Ping is revelling in his fulfilled dreams as he serves as the fabled Dragon Warrior protecting his home with his heroes now his closest friends. However, Po and company learn that the murderous Lord Shen of Gongman City is threatening the land with a fearsome new weapon that could mean the end of kung fu. They attempt to stop him, but the panda is burdened with crippling memory flashbacks linked to this villain. Now with China in the balance, Po must learn about his past and find true inner peace against all opposition.",https://images-na.ssl-images-amazon.com/images/M/MV5BMTg4MTQ3NTI3Nl5BMl5BanBnXkFtZTcwNzEzODQ2NA@@._V1_SX300.jpg,67,tt1302011,165230261
Puss in Boots,2011,PG,90,Animation,Antonio Banderas,TRUE,Salma Hayek,FALSE,"Years before meeting Shrek and Donkey, the adorable but tricky Puss in Boots must clear his name from all charges making him a wanted fugitive. While trying to steal magic beans from the infamous criminals Jack and Jill, the hero crosses paths with his female match, Kitty Softpaws, who leads Puss to his old friend, but now enemy, Humpty Dumpty. Memories of friendship and betrayal enlarges Puss' doubt, but he eventually agrees to help the egg get the magic beans. Together, the three plan to steal the beans, get to the Giant's castle, nab the golden goose, and clear Puss' name.",https://ia.media-imdb.com/images/M/MV5BMTMxMTU5MTY4MV5BMl5BanBnXkFtZTcwNzgyNjg2NQ@@._V1_SX300.jpg,65,tt0448694,149234747
X-Men: First Class,2011,PG-13,131,Action,James McAvoy,TRUE,Michael Fassbender,TRUE,"Before Charles Xavier and Erik Lensherr took the names Professor X and Magneto, they were two young men discovering their powers for the first time. Before they were archenemies, they were closest of friends, working together, with other Mutants (some familiar, some new), to stop the greatest threat the world has ever known. In the process, a rift between them opened, which began the eternal war between Magneto's Brotherhood and Professor X's X-MEN.",https://ia.media-imdb.com/images/M/MV5BMTg5OTMxNzk4Nl5BMl5BanBnXkFtZTcwOTk1MjAwNQ@@._V1_SX300.jpg,65,tt1270798,145300000
Rio,2011,G,96,Animation,Jesse Eisenberg,TRUE,Anne Hathaway,FALSE,"In Rio de Janeiro, baby macaw, Blu, is captured by dealers and smuggled to the USA. While driving through Moose Lake, Minnesota, the truck that is transporting Blu accidentally drops Blu's box on the road. A girl, Linda, finds the bird and raises him with love. Fifteen years later, Blu is a domesticated and intelligent bird that does not fly and lives a comfortable life with bookshop owner Linda. Out of the blue, clumsy Brazilian ornithologist, Tulio, visits Linda and explains that Blu is the last male of his species, and he has a female called Jewel in Rio de Janeiro. He invites Linda to bring Blu to Rio so that he and Jewel can save their species. Linda travels with Blu and Tulio to Rio de Janeiro and they leave Blu and Jewel in a large cage in the institute where Tulio works. While they are having dinner, smugglers break into the institute and steal Blu and Jewel to sell them. Linda and Tulio look everywhere for Blu, who is chained to Jewel and hidden in a slum. Meanwhile, Jewel and Blu escape from their captors and befriend a group of birds that help them to get rid of the chains. It is Carnival and the smugglers and mean cockatoo, Nigel, do not intend to give up Blu and Jewel, and chase the birds through the crowded streets.",https://ia.media-imdb.com/images/M/MV5BMTU2MDY3MzAzMl5BMl5BanBnXkFtZTcwMTg0NjM5NA@@._V1_SX300.jpg,63,tt1436562,143613651
The Smurfs,2011,PG,103,Animation,Hank Azaria,TRUE,Katy Perry,FALSE,"When the evil wizard Gargamel chases the tiny blue Smurfs out of their village, they tumble from their magical world and into ours -- in fact, smack dab in the middle of Central Park. Just three apples high and stuck in the Big Apple, the Smurfs must find a way to get back to their village before Gargamel tracks them down.",https://images-na.ssl-images-amazon.com/images/M/MV5BOTUzNTczYTMtMzdkOC00ODlkLTk1NDMtYWYxMzQyYzI1YmVjXkEyXkFqcGdeQXVyNDQ2MTMzODA@._V1_SX300.jpg,30,tt0472181,142614158
Alvin and the Chipmunks: Chipwrecked,2011,G,87,Animation,Justin Long,TRUE,Matthew Gray Gubler,TRUE,"Playing around while aboard a cruise ship, the Chipmunks and Chipettes accidentally go overboard and end up marooned in a tropical paradise. They discover their new turf is not as deserted as it seems.","https://ia.media-imdb.com/images/M/MV5BMTMyMTU3NTg5Nl5BMl5BanBnXkFtZTcwNDMyMjc2NQ@@._V1.._SY132_CR0,0,89,132_AL_.jpg_V1_SX300.jpg",24,tt1615918,133103929
Super 8,2011,PG-13,112,Mystery,Elle Fanning,FALSE,AJ Michalka,FALSE,"SPOILER: In the summer of 1979, a group of friends in a small Ohio town witness a catastrophic train crash while making a super 8 movie and soon suspect that it was not an accident. Shortly after, unusual disappearances and inexplicable events begin to take place in town, and the local Deputy tries to uncover the truth - something more terrifying than any of them could have imagined.",https://ia.media-imdb.com/images/M/MV5BMjIzNjEyMzcwOF5BMl5BanBnXkFtZTcwMTkyMjE0NQ@@._V1_SX300.jpg,72,tt1650062,126975169
Rango,2011,PG,107,Animation,Johnny Depp,TRUE,Isla Fisher,FALSE,"Rango is a pet chameleon always on the lookout for action and adventure, except the fake kind, where he directs it and acts in it. After a car accident, he winds up in an old western town called Dirt. What this town needs the most is water, but they also need a hero and a sheriff. The thirsty Rango instantly takes on the role of both and selfishly agrees to take on the case of their missing water.",https://images-na.ssl-images-amazon.com/images/M/MV5BMjE5ODg1NTk3OF5BMl5BanBnXkFtZTcwNzA5NTMyNA@@._V1_SX300.jpg,75,tt1192628,123188232
Horrible Bosses,2011,R,98,Comedy,Jason Bateman,TRUE,Charlie Day,TRUE,"Nick hates his boss, mostly because he's expected to work from before sunrise to after sunset and his boss, Mr. Harken, calls him out for being a minute late and blackmails him so he can't quit. Dale hates his boss, Dr. Julia Harris, because she makes unwelcome sexual advances when he's about to get married. But Dale is on that pesky list of child offenders so he can't quit. Kurt actually likes his job and his boss, well, up until his boss dies and the boss's coked-out, psychopathic son takes over. But who would be crazy enough to quit their jobs in such poor economic times? Instead Nick, Dale and Kurt drunkenly and hypothetically discuss how to kill their bosses, and before they know it, they've hired a murder consultant to help them pull off the three deeds.",https://ia.media-imdb.com/images/M/MV5BNzYxNDI5Njc5NF5BMl5BanBnXkFtZTcwMDUxODE1NQ@@._V1_SX300.jpg,57,tt1499658,116900000
Green Lantern,2011,PG-13,114,Action,Ryan Reynolds,TRUE,Blake Lively,FALSE,"In a mysterious universe, the Green Lantern Corps, an elite defense force of peace and justice have existed for centuries. Reckless test pilot Hal Jordan acquires superhuman powers when he is chosen by the Ring, the willpower-fed source of power. Reluctantly at first, he takes on the challenge after the death of Abin Sur, the finest Green Lantern. Putting his self-doubts aside, and spurred on by his sense of duty and love for his beautiful, intellectually equal, colleague, Carol Ferris, he is soon called to defend mankind from Parallax, a powerful, evil being who feeds on fear. Hal Jordan is the universe's last chance, as many Green Lanterns have been killed and the Corps is weakened. And he might just be the right Green Lantern for the duty of keeping the world safe from harm.",https://ia.media-imdb.com/images/M/MV5BMTMyMTg3OTM5Ml5BMl5BanBnXkFtZTcwNzczMjEyNQ@@._V1_SX300.jpg,39,tt1133985,116600000
Hop,2011,PG,95,Animation,Russell Brand,TRUE,James Marsden,TRUE,"Blending state-of-the-art animation with live action, Hop tells the comic tale of Fred, an out-of-work slacker who accidentally injures the Easter Bunny and must take him in as he recovers. As Fred struggles with the world's worst house guest, both will learn what it takes to finally grow up.",https://ia.media-imdb.com/images/M/MV5BMTY4MDcxNTkzNV5BMl5BanBnXkFtZTcwMTg2MDY2NA@@._V1_SX300.jpg,41,tt1411704,108012170
Paranormal Activity 3,2011,R,83,Horror,Chloe Csengery,FALSE,Jessica Tyler Brown,FALSE,"In 1988, in California, cinematographer Dennis moves to the house of his girlfriend Julie to raise a family with her daughters Katie and Kristi. Little Kristi has an imaginary friend named Toby while weird things happen in the house. Dennis decides to place cameras in the house to capture images during the night and soon he finds that there is an entity in the house. Dennis's friend Randy Rosen (Dustin Ingram) researches the events and learns that his house might be a coven of witches and the children may be in danger.",https://ia.media-imdb.com/images/M/MV5BMTk0MTQzODQzOV5BMl5BanBnXkFtZTcwMDQ2NzQ3Ng@@._V1_SX300.jpg,59,tt1778304,103993239
Just Go with It,2011,PG-13,117,Comedy,Adam Sandler,TRUE,Jennifer Aniston,FALSE,"Danny (Adam Sandler) must engage Katherine (Jennifer Aniston), his faithful assistant, to pretend to be his soon to be ex-wife. Danny must pretend that he is married, because he lied to his dream girl, Palmer (Brooklyn Decker) the most gorgeous woman in the world. To keep the woman he loves, covering up one lie soon turns into many lies.",https://ia.media-imdb.com/images/M/MV5BMjE0MTk3MjE2Nl5BMl5BanBnXkFtZTcwMjE0ODA0NA@@._V1_SX300.jpg,33,tt1564367,103028109
The Girl with the Dragon Tattoo,2011,R,158,Crime,Daniel Craig,TRUE,Rooney Mara,FALSE,"This English-language adaptation of the Swedish novel by Stieg Larsson follows a disgraced journalist, Mikael Blomkvist (Daniel Craig), as he investigates the disappearance of a wealthy patriarch's niece from 40 years ago. He is aided by the pierced, tattooed, punk computer hacker named Lisbeth Salander (Rooney Mara). As they work together in the investigation, Blomkvist and Salander uncover immense corruption beyond anything they have ever imagined.",https://ia.media-imdb.com/images/M/MV5BMTczNDk4NTQ0OV5BMl5BanBnXkFtZTcwNDAxMDgxNw@@._V1_SX300.jpg,71,tt1568346,102515793
Bad Teacher,2011,R,92,Comedy,Cameron Diaz,FALSE,Jason Segel,TRUE,"When her wealthy fiancé breaks it off, gold digger Elizabeth Halsey returns to middle school: she's an awful teacher but wants to save for breast-implant surgery. She brightens when Scott, a new teacher, turns out to be rich, and she stops showing films and sleeping in class when told there's a bonus for the teacher whose class scores highest on the state exam. Her competition for Scott and the bonus is cheery and tightly wound Amy. Amy digs for dirt on Elizabeth who cheats her way toward Scott's bed and the money. Honesty with students seems to be her only skill. She ignores Russell, a droll gym teacher, who looks on. Will she succeed with Scott and get those new breasts?",https://ia.media-imdb.com/images/M/MV5BMTQ5NDI4MDM0Nl5BMl5BanBnXkFtZTcwNDYwODU2NA@@._V1_SX300.jpg,47,tt1284575,100292856
Cowboys & Aliens,2011,PG-13,119,Action,Daniel Craig,TRUE,Harrison Ford,TRUE,"The Old West.. where a lone cowboy leads an uprising against a terror from beyond our world. 1873. New Mexico Territory. A stranger with no memory of his past stumbles into the hard desert town of Absolution. The only hint to his history is a mysterious shackle that encircles one wrist. What he discovers is that the people of Absolution don't welcome strangers, and nobody makes a move on its streets unless ordered to do so by the iron-fisted Colonel Dolarhyde (Ford). It's a town that lives in fear. But Absolution is about to experience fear it can scarcely comprehend as the desolate city is attacked by marauders from the sky. Screaming down with breathtaking velocity and blinding lights to abduct the helpless one by one, these monsters challenge everything the residents have ever known. Now, the stranger they rejected is their only hope for salvation. As this gunslinger slowly starts to remember who he is and where he's been, he realizes he holds a secret that could give the town a fighting chance against the alien force. With the help of the elusive traveler Ella (Olivia Wilde), he pulls together a posse comprised of former opponents-townsfolk, Dolarhyde and his boys, outlaws and Apache warriors-all in danger of annihilation. United against a common enemy, they will prepare for an epic showdown for survival.",https://ia.media-imdb.com/images/M/MV5BMTM1MzkyNzQ3OV5BMl5BanBnXkFtZTcwMDk1NTg2NQ@@._V1_SX300.jpg,50,tt0409847,100215116
Gnomeo and Juliet,2011,G,84,Animation,James McAvoy,TRUE,Emily Blunt,FALSE,"The neighboring gardens of Montague and Capulet are at war, but the gnomes, Gnomeo and Juliet, are in love. ","https://ia.media-imdb.com/images/M/MV5BMjAyNDM2MDA2NF5BMl5BanBnXkFtZTcwOTMxMDAxNA@@._V1_UX182_CR0,0,182,268_AL_.jpg",53,tt0377981,99967670
The Green Hornet,2011,PG-13,119,Action,Seth Rogen,TRUE,Jay Chou,TRUE,"Playboy Britt Reid (Seth Rogen) becomes the new publisher of Los Angeles' ""The Daily Sentinel"" after the sudden death of his father. Britt's party life is about to change when he and his driver and kung fu expert, Kato (Jay Chou), stop a robbery. With the help of Kato, Britt starts a new career of fighting crime as the masked superhero ""The Green Hornet"".",https://images-na.ssl-images-amazon.com/images/M/MV5BMTcwOTMwMDYyMl5BMl5BanBnXkFtZTcwMzAxMjMyNA@@._V1_SX300.jpg,39,tt0990407,98000000
The Lion King (in 3D),2011,G,88,Animation,Matthew Broderick,TRUE,Jeremy Irons,TRUE,"A Lion cub crown prince is tricked by a treacherous uncle into thinking he caused his father's death and flees into exile in despair, only to learn in adulthood his identity and his responsibilities. ","https://ia.media-imdb.com/images/M/MV5BYTYxNGMyZTYtMjE3MS00MzNjLWFjNmYtMDk3N2FmM2JiM2M1XkEyXkFqcGdeQXVyNjY5NDU4NzI@._V1_UX182_CR0,0,182,268_AL_.jpg",83,tt0110357,312900000
The Muppets,2011,PG,103,Adventure,Amy Adams,FALSE,Jason Segel,TRUE,"When 3 Muppet fans learn that Tex Richman wants to drill under the Muppet Theater for oil, Gary, Mary and Walter set out to find the Muppets who have been split up for years so that they can put on one last show and save the Muppet Theater. Kermit the Frog now lives in his own mansion depressed in Hollywood, 'The Great Gonzo' is a high class plumber at Gonzo's Royal Flush, Fozzie Bear performs with a tribute band called The Moopets, Miss Piggy is the plus-size fashion editor at Vogue Paris, and Animal is at a celebrity anger management rehab center in Santa Barbara.",https://images-na.ssl-images-amazon.com/images/M/MV5BMjE0MTM4NTc3NF5BMl5BanBnXkFtZTcwMjYzOTIxNg@@._V1_SX300.jpg,75,tt1204342,88625922
