Title,Year,Rated,Runtime,Genre,Lead_1,Lead_1_Male,Lead_2,Lead_2_Male,Plot,Poster,Metascore,imdbID,BoxOffice
Heaven Is for Real,2014,PG,99,Biography,Greg Kinnear,TRUE,Kelly Reilly,FALSE,"This is the story of a small-town father who must find the courage and conviction to share his son's extraordinary, life-changing experience with the world. His son Colton claims to have visited Heaven during a near death experience. Colton recounts the details of his amazing journey with childlike innocence and speaks matter-of-factly about things that happened before his birth... things he couldn't possibly know. Todd and his family are then challenged to examine the meaning from this remarkable event. The church turns on him and so does eveyone who is closer or further to him including his wife.",https://images-na.ssl-images-amazon.com/images/M/MV5BNjc3MzYzMTUzNF5BMl5BanBnXkFtZTgwNTYzNzI2MDE@._V1_SX300.jpg,47,tt1929263,91443253
The Imitation Game,2014,PG-13,114,Biography,Benedict Cumberbatch,TRUE,Keira Knightley,FALSE,"Based on the real life story of legendary cryptanalyst Alan Turing, the film portrays the nail-biting race against time by Turing and his brilliant team of code-breakers at Britain's top-secret Government Code and Cypher School at Bletchley Park, during the darkest days of World War II.",https://images-na.ssl-images-amazon.com/images/M/MV5BOTgwMzFiMWYtZDhlNS00ODNkLWJiODAtZDVhNzgyNzJhYjQ4L2ltYWdlXkEyXkFqcGdeQXVyNzEzOTYxNTQ@._V1_SX300.jpg,73,tt2084970,91125683
Dumb and Dumber To,2014,PG-13,109,Adventure,Jim Carrey,TRUE,Jeff Daniels,TRUE,"It's been 20 years and Harry Dunn has found something out - he has a daughter! Lloyd Christmas, his equally dim-witted friend, takes one look at a picture of her, develops a crush, and insists the two track her down. What ensues when Harry finally agrees is a bizarre encounter with an old lady and more hilarity because of their sheer stupidity.",https://ia.media-imdb.com/images/M/MV5BMTYxMzA0MzAyMF5BMl5BanBnXkFtZTgwMjMyNjcwMjE@._V1_SX300.jpg,36,tt2096672,86208010
Annie,2014,PG,118,Comedy,Quvenzhané Wallis,FALSE,Cameron Diaz,FALSE,"Annie is a young, happy foster kid who's also tough enough to make her way on the streets of New York in 2014. Originally left by her parents as a baby with the promise that they'd be back for her someday, it's been a hard knock life ever since with her mean foster mom Miss Hannigan. But everything's about to change when the hard-nosed tycoon and New York mayoral candidate Will Stacks - advised by his brilliant VP, Grace and his shrewd and scheming campaign advisor, Guy - makes a thinly-veiled campaign move and takes her in. Stacks believes he's her guardian angel, but Annie's self-assured nature and bright, sun-will-come-out-tomorrow outlook on life just might mean it's the other way around.",https://ia.media-imdb.com/images/M/MV5BMTAyNDYxOTI4MzNeQTJeQWpwZ15BbWU4MDQ3MDU3NjIx._V1_SX300.jpg,33,tt1823664,58614089
Fury,2014,R,134,Action,Brad Pitt,TRUE,Shia LaBeouf,TRUE,"1945, in World War II Germany, the tough Sergeant Don 'Wardaddy' Collier commands a tank and survives a German attack with his veteran crew composed of Boyd 'Bible' Swan, Trini 'Gordo' Garcia and Grady 'Coon-Ass' Travis. He receives a rookie soldier Norman Ellison as the substitute for his deceased gunner and he tries to harden the youth along the way.",https://ia.media-imdb.com/images/M/MV5BMjA4MDU0NTUyN15BMl5BanBnXkFtZTgwMzQxMzY4MjE@._V1_SX300.jpg,64,tt2713180,72609225
Tammy,2014,R,97,Comedy,Melissa McCarthy,FALSE,Susan Sarandon,FALSE,"Tammy, who was recently fired from a Topper Jack's fast food restaurant, returns home only to find her husband enjoying a romantic meal with the neighbor. She quickly packs her necessities, and travels down three houses to her parent's home. Upon denied use of her mom's car to drive to Niagara Falls, she quickly resorts to an ""ailing"" grandmother, who also lives in the home...Only instead of traveling alone, Grandma Pearl wants in on the road trip. After realizing Grandma Pearl has the funds, they hit the road. Pearl soon proves to be quite the alcoholic despite her diabetes, and Tammy quickly turns into the ""baby-sitter."" From finding love in a bar to robbing a Topper Jack's in order to bail Pearl out of jail,the quirky adventure will have you finding yourself riding along for the misadventures of Tammy.","https://images-na.ssl-images-amazon.com/images/M/MV5BMjIyMDg1ODM5OV5BMl5BanBnXkFtZTgwMTM4NzgxMTE@._V1._CR3,3,863,1275_SY132_CR0,0,89,132_AL_.jpg_V1_SX300.jpg",39,tt2103254,51033986
Annabelle,2014,R,99,Horror,Ward Horton,TRUE,Annabelle Wallis,FALSE,"John Form has found the perfect gift for his expectant wife, Mia - a beautiful, rare vintage doll in a pure white wedding dress. But Mia's delight with Annabelle doesn't last long. On one horrific night, their home is invaded by members of a satanic cult, who violently attack the couple. Spilled blood and terror are not all they leave behind. The cultists have conjured an entity so malevolent that nothing they did will compare to the sinister conduit to the damned that is now... Annabelle.",https://images-na.ssl-images-amazon.com/images/M/MV5BOTQwZmQyYzEtODk5ZC00OTY3LWExMjAtYzRjNWFhNGM3MzBlXkEyXkFqcGdeQXVyNTIzOTk5ODM@._V1_SX300.jpg,37,tt3322940,84273813
The Other Woman,2014,PG-13,109,Comedy,Cameron Diaz,FALSE,Leslie Mann,FALSE,"After discovering her boyfriend is married, Carly Whitten tries to get her ruined life back on track. But when she accidentally meets the wife he's been cheating on, she realizes they have much in common, and her sworn enemy becomes her greatest friend. When yet another affair is discovered, all three women team up to plot mutual revenge on their cheating, lying, three-timing SOB.",https://images-na.ssl-images-amazon.com/images/M/MV5BMTc0ODE4ODY1OF5BMl5BanBnXkFtZTgwMDA5NjkzMTE@._V1_SX300.jpg,39,tt2203939,77860761
Penguins of Madagascar,2014,PG,92,Animation,Tom McGrath,TRUE,Chris Miller,TRUE,"Super spy teams aren't born...they're hatched. Discover the secrets of the greatest and most hilarious covert birds in the global espionage biz: Skipper, Kowalski, Rico and Private. These elitists of the elite are joining forces with a chic undercover organization, The North Wind. Led by handsome and husky Agent Classified (we could tell you his name, but then...you know). Together, they must stop the villainous Dr. Octavius Brine, from destroying the world as we know it.",https://images-na.ssl-images-amazon.com/images/M/MV5BMTEyMDg4MDU4MjdeQTJeQWpwZ15BbWU4MDQyOTc3MjIx._V1_SX300.jpg,53,tt1911658,70727688
Let's Be Cops,2014,R,104,Comedy,Jake Johnson,TRUE,Damon Wayans Jr.,TRUE,"It's the ultimate buddy cop movie except for one thing: they're not cops. When two struggling pals dress as police officers for a costume party, they become neighborhood sensations. But when these newly-minted ""heroes"" get tangled in a real life web of mobsters and dirty detectives, they must put their fake badges on the line.",https://images-na.ssl-images-amazon.com/images/M/MV5BMjI3MDY2ODQwNF5BMl5BanBnXkFtZTgwNjUzNjE4MTE@._V1_SX300.jpg,30,tt1924435,82390774
The Monuments Men,2014,PG-13,118,Drama,George Clooney,TRUE,Matt Damon,TRUE,"Based on the true story of the greatest treasure hunt in history, The Monuments Men is an action drama focusing on an unlikely World War II platoon, tasked by FDR with going into Germany to rescue artistic masterpieces from Nazi thieves and returning them to their rightful owners. It would be an impossible mission: with the art trapped behind enemy lines, and with the German army under orders to destroy everything as the Reich fell, how could these guys - seven museum directors, curators, and art historians, all more familiar with Michelangelo than the M-1 - possibly hope to succeed? But as the Monuments Men, as they were called, found themselves in a race against time to avoid the destruction of 1000 years of culture, they would risk their lives to protect and defend mankind's greatest achievements.",https://ia.media-imdb.com/images/M/MV5BMjMxMjk4NTM1M15BMl5BanBnXkFtZTgwNjg0MjQ3MDE@._V1_SX300.jpg,52,tt2177771,67239378
Hercules,2014,PG-13,98,Action,Dwayne Johnson,TRUE,John Hurt,TRUE,"Fourteen hundred years BCE, a tormented soul walked the earth that was neither man nor god. Hercules was the powerful son of the god king Zeus, for this he received nothing but suffering his entire life. After twelve arduous labours and the loss of his family, this dark, world-weary soul turned his back on the gods finding his only solace in bloody battle. Over the years he warmed to the company of six similar souls, their only bond being their love of fighting and presence of death. These men and women never question where they go to fight or why or whom, just how much they will be paid. Now the King of Thrace has hired these mercenaries to train his men to become the greatest army of all time. It is time for this bunch of lost souls to finally have their eyes opened to how far they have fallen when they must train an army to become as ruthless and blood thirsty as their reputation has become.",https://ia.media-imdb.com/images/M/MV5BMTQ4ODA5MTA4OF5BMl5BanBnXkFtZTgwNjMyODM5MTE@._V1_SX300.jpg,47,tt1267297,59445889
The Purge: Anarchy,2014,R,103,Action,Frank Grillo,TRUE,Carmen Ejogo,FALSE,"A couple are driving home when their car breaks down just as the Purge commences. Meanwhile, a police sergeant goes out into the streets to get revenge on the man who killed his son, and a mother and daughter run from their home after assailants destroy it. The five people meet up as they attempt to survive the night in Los Angeles.",https://ia.media-imdb.com/images/M/MV5BMjE2ODMxMTk1Nl5BMl5BanBnXkFtZTgwMDEzNjEzMTE@._V1_SX300.jpg,50,tt2975578,71962800
"Alexander and the Terrible, Horrible, No Good, Very Bad Day",2014,PG,81,Comedy,Steve Carell,TRUE,Jennifer Garner,FALSE,"For 12 year old Alexander Cooper, everyday is a bad day. And his family thinks he's being silly because they never have a bad day. On the day before his 12th birthday party, he learns that another boy is having a party of his own and everyone is going to it. And another kid punks him online. So at midnight of his birthday, he wishes that his whole family can have a bad day. And things for the whole family go bad, his mom's car is broken so they have to share a car, his sister has a cold and has to go on stage, his older brother, who's hoping to get his driver's license and to bring his girlfriend to the prom, has to deal with his girlfriend's snootiness and fails to get his license, his mom has a crisis at work which could cost her her job, and his dad who has a job interview has to bring his younger brother with him but because his pacifier is broken he can't stop crying. Alex feels responsible.",https://ia.media-imdb.com/images/M/MV5BOTgxMDMxMTY5OV5BMl5BanBnXkFtZTgwMjY1NzYzMjE@._V1_SX300.jpg,54,tt1698641,56752482
Think Like a Man Too,2014,PG-13,106,Comedy,Kevin Hart,TRUE,Gabrielle Union,FALSE,"In the highly anticipated sequel, which was inspired by Steve Harvey's best-selling book Act Like a Lady, Think Like a Man, all the couples are back for a wedding in Las Vegas. But plans for a romantic weekend go awry when their various misadventures get them into some compromising situations that threaten to derail the big event.",https://ia.media-imdb.com/images/M/MV5BMjE2NjMxNjU1OF5BMl5BanBnXkFtZTgwMTI1OTgxMTE@._V1_SX300.jpg,38,tt2239832,65182182
Exodus: Gods and Kings,2014,PG-13,150,Action,Christian Bale,TRUE,Joel Edgerton,TRUE,"Epic adventure Exodus: Gods and Kings is the story of one man's daring courage to take on the might of an empire. Using state of the art visual effects and 3D immersion, Scott brings new life to the story of the defiant leader Moses as he rises up against the Egyptian Pharaoh Ramses, setting 600,000 slaves on a monumental journey of escape from Egypt and its terrifying cycle of deadly plagues.",https://ia.media-imdb.com/images/M/MV5BMjI3MDY0NjkxNl5BMl5BanBnXkFtZTgwNTM3NTA0MzE@._V1_SX300.jpg,52,tt1528100,65014513
