Title,Year,Rated,Runtime,Genre,Lead_1,Lead_1_Male,Lead_2,Lead_2_Male,Plot,Poster,Metascore,imdbID,BoxOffice
American Sniper,2014,R,133,Action,Bradley Cooper,TRUE,Sienna Miller,FALSE,"Chris Kyle was nothing more than a Texan man who dreamed of becoming a cowboy, but in his thirties he found out that maybe his life needed something different, something where he could express his real talent, something that could help America in its fight against terrorism. So he joined the SEALs in order to become a sniper. After marrying, Kyle and the other members of the team are called for their first tour of Iraq. Kyle's struggle isn't with his missions, but about his relationship with the reality of the war and, once returned at home, how he manages to handle it with his urban life, his wife and kids.",https://ia.media-imdb.com/images/M/MV5BMTkxNzI3ODI4Nl5BMl5BanBnXkFtZTgwMjkwMjY4MjE@._V1_SX300.jpg,72,tt2179136,274377268
The Hunger Games: Mockingjay - Part 1,2014,PG-13,123,Action,Jennifer Lawrence,FALSE,Josh Hutcherson,TRUE,"With the Games destroyed, Katniss Everdeen, along with Gale, Finnick and Beetee, end up in the so thought ""destroyed"" District 13. Under the leadership of President Coin and the advice of her friends, Katniss becomes the ""Mockingjay"", the symbol of rebellion for the districts of Panem.",https://images-na.ssl-images-amazon.com/images/M/MV5BMTcxNDI2NDAzNl5BMl5BanBnXkFtZTgwODM3MTc2MjE@._V1_SX300.jpg,64,tt1951265,295457212
Guardians of the Galaxy,2014,PG-13,121,Action,Chris Pratt,TRUE,Vin Diesel,TRUE,"After stealing a mysterious orb in the far reaches of outer space, Peter Quill from Earth, is now the main target of a manhunt led by the villain known as Ronan the Accuser. To help fight Ronan and his team and save the galaxy from his power, Quill creates a team of space heroes known as the ""Guardians of the Galaxy"" to save the world.",https://ia.media-imdb.com/images/M/MV5BMTAwMjU5OTgxNjZeQTJeQWpwZ15BbWU4MDUxNDYxODEx._V1_SX300.jpg,76,tt2015381,270592504
Captain America: The Winter Soldier,2014,PG-13,136,Action,Chris Evans,TRUE,Samuel L. Jackson,TRUE,"For Steve Rogers, awakening after decades of suspended animation involves more than catching up on pop culture; it also means that this old school idealist must face a world of subtler threats and difficult moral complexities. That becomes clear when Director Nick Fury is killed by the mysterious assassin, the Winter Soldier, but not before warning Rogers that SHIELD has been subverted by its enemies. When Rogers acts on Fury's warning to trust no one there, he is branded as a traitor by the organization. Now a fugitive, Captain America must get to the bottom of this deadly mystery with the help of the Black Widow and his new friend, The Falcon. However, the battle will be costly for the Sentinel of Liberty, with Rogers finding enemies where he least expects them while learning that the Winter Soldier looks disturbingly familiar.",https://images-na.ssl-images-amazon.com/images/M/MV5BMjM2NzUzNzQwNl5BMl5BanBnXkFtZTgwMDQ1MDkwMTE@._V1_SX300.jpg,70,tt1843866,228636083
The Lego Movie,2014,PG,100,Animation,Chris Pratt,TRUE,Will Ferrell,TRUE,"The LEGO Movie is a 3D animated film which follows lead character, Emmet a completely ordinary LEGO mini-figure who is identified as the most ""extraordinary person"" and the key to saving the Lego universe. Emmet and his friends go on an epic journey to stop the evil tyrant, Lord Business.",https://ia.media-imdb.com/images/M/MV5BMTg4MDk1ODExN15BMl5BanBnXkFtZTgwNzIyNjg3MDE@._V1_SX300.jpg,83,tt1490017,244870202
The Hobbit: The Battle of the Five Armies,2014,PG-13,144,Adventure,Ian McKellen,TRUE,Martin Freeman,TRUE,"After the Dragon leaves the Lonely Mountain, the people of Lake-town see a threat coming. Orcs, dwarves, elves and people prepare for war. Bilbo sees Thorin going mad and tries to help. Meanwhile, Gandalf is rescued from the Necromancer's prison and his rescuers realize who the Necromancer is.",https://images-na.ssl-images-amazon.com/images/M/MV5BODAzMDgxMDc1MF5BMl5BanBnXkFtZTgwMTI0OTAzMjE@._V1_SX300.jpg,59,tt2310332,187747747
Transformers: Age of Extinction,2014,PG-13,165,Action,Mark Wahlberg,TRUE,Nicola Peltz,FALSE,"After the battle between the Autobots and Decepticons that leveled Chicago, humanity thinks that all alien robots are a threat. So Harold Attinger, a CIA agent, establishes a unit whose sole purpose is to hunt down all of them. But it turns out that they are aided by another alien robot who is searching for Optimus Prime. Cade Yeager, a ""robotics expert"", buys an old truck and upon examining it, he thinks it's a Transformer. When he powers it up, he discovers it's Optimus Prime. Later, men from the unit show up looking for Optimus. He helps Yeager and his daughter Tessa escape but are pursued by the hunter. They escape and Yeager learns from technology he took from the men that a technology magnate and defense contractor named Joshua Joyce is part of what's going on, so they go to find out what's going on.",https://ia.media-imdb.com/images/M/MV5BMjE1OTMyODA5M15BMl5BanBnXkFtZTgwMjc2MDk3MTE@._V1_SX300.jpg,32,tt2109248,206755538
Maleficent,2014,PG,97,Action,Angelina Jolie,FALSE,Elle Fanning,FALSE,"A beautiful, pure-hearted young woman, Maleficent has an idyllic life growing up in a peaceable forest kingdom, until one day when an invading army threatens the harmony of the land. Maleficent rises to be the land's fiercest protector, but she ultimately suffers a ruthless betrayal - an act that begins to turn her pure heart to stone. Bent on revenge, Maleficent faces a battle with the invading king's successor and, as a result, places a curse upon his newborn infant Aurora. As the child grows, Maleficent realizes that Aurora holds the key to peace in the kingdom - and perhaps to Maleficent's true happiness as well.",https://images-na.ssl-images-amazon.com/images/M/MV5BMjAwMzAzMzExOF5BMl5BanBnXkFtZTgwOTcwMDA5MTE@._V1_SX300.jpg,56,tt1587310,190871149
X-Men: Days of Future Past,2014,PG-13,132,Action,Patrick Stewart,TRUE,Ian McKellen,TRUE,"In the future, the mutants and the humans that help them are slaughtered by powerful robots named Sentinels. Professor Xavier, Wolverine, Magneto, Storm, Kitty Pryde and her friends meet at a monastery in China and Xavier explains that the invincible Sentinels were created using the DNA of Mystique that was captured in 1973 when she tried to assassinate their creator Dr. Bolivar Trask. Xavier tells that their only chance is return to 1973 using Pryde's ability to join Charles Xavier and Erik Lehnsherr to convince Mystique to give up of her intention. . However, only Wolverine can withstand the damages of the time travel. Will he succeed in stopping Mystique and the Sentinel Program and save the mutants and their human friends from annihilation?",https://ia.media-imdb.com/images/M/MV5BZGIzNWYzN2YtMjcwYS00YjQ3LWI2NjMtOTNiYTUyYjE2MGNkXkEyXkFqcGdeQXVyMTQxNzMzNDI@._V1_SX300.jpg,74,tt1877832,199305306
Big Hero 6,2014,PG,102,Animation,Ryan Potter,TRUE,Scott Adsit,TRUE,"When a devastating event befalls the city of San Fransokyo and catapults Hiro into the midst of danger, he turns to Baymax and his close friends adrenaline junkie Go Go Tomago, neatnik Wasabi, chemistry whiz Honey Lemon and fanboy Fred. Determined to uncover the mystery, Hiro transforms his friends into a band of high-tech heroes called ""Big Hero 6.""",https://images-na.ssl-images-amazon.com/images/M/MV5BMDliOTIzNmUtOTllOC00NDU3LWFiNjYtMGM0NDc1YTMxNjYxXkEyXkFqcGdeQXVyNTM3NzExMDQ@._V1_SX300.jpg,74,tt2245084,222527828
Dawn of the Planet of the Apes,2014,PG-13,130,Action,Gary Oldman,TRUE,Keri Russell,FALSE,"A growing nation of genetically evolved apes led by Caesar is threatened by a band of human survivors of the devastating virus unleashed a decade earlier. They reach a fragile peace, but it proves short-lived, as both sides are brought to the brink of a war that will determine who will emerge as Earth's dominant species.",https://ia.media-imdb.com/images/M/MV5BMTgwODk3NDc1N15BMl5BanBnXkFtZTgwNTc1NjQwMjE@._V1_SX300.jpg,79,tt2103281,183278877
The Amazing Spider-Man 2,2014,PG-13,142,Action,Andrew Garfield,TRUE,Emma Stone,FALSE,"We've always known that Spider-Man's most important conflict has been within himself: the struggle between the ordinary obligations of Peter Parker and the extraordinary responsibilities of Spider-Man. But in The Amazing Spider-Man 2, Peter Parker finds that his greatest battle is about to begin. It's great to be Spider-Man. For Peter Parker, there's no feeling quite like swinging between skyscrapers, embracing being the hero, and spending time with Gwen. But being Spider-Man comes at a price: only Spider-Man can protect his fellow New Yorkers from the formidable villains that threaten the city. With the emergence of Electro, Peter must confront a foe far more powerful than he. And as his old friend, Harry Osborn, returns, Peter comes to realize that all of his enemies have one thing in common: Oscorp.",https://images-na.ssl-images-amazon.com/images/M/MV5BOTA5NDYxNTg0OV5BMl5BanBnXkFtZTgwODE5NzU1MTE@._V1_SX300.jpg,53,tt1872181,183277573
Godzilla,2014,PG-13,123,Action,Aaron Taylor-Johnson,TRUE,Elizabeth Olsen,FALSE,"In 1999, the Janjira nuclear plant was mysteriously destroyed with most hands lost including supervisor Joe Brody's colleague and wife, Sandra. Years later, Joe's son, Ford, a US Navy ordnance disposal officer, must go to Japan to help his estranged father who obsessively searches for the truth of the incident. In doing so, father and son discover the disaster's secret cause on the wreck's very grounds. This enables them to witness the reawakening of a terrible threat to all of Humanity, which is made all the worse with a second secret revival elsewhere. Against this cataclysm, the only hope for the world may be Godzilla, but the challenge for the King of the Monsters will be great even as Humanity struggles to understand the destructive ally they have.",https://images-na.ssl-images-amazon.com/images/M/MV5BN2E4ZDgxN2YtZjExMS00MWE5LTg3NjQtNTkxMzJhOTA3MDQ4XkEyXkFqcGdeQXVyMTQxNzMzNDI@._V1_SX300.jpg,62,tt0831387,172962996
22 Jump Street,2014,R,112,Action,Channing Tatum,TRUE,Jonah Hill,TRUE,"After making their way through high school (twice), big changes are in store for officers Schmidt (Jonah Hill) and Jenko (Channing Tatum) when they go deep undercover at a local college. But when Jenko meets a kindred spirit on the football team, and Schmidt infiltrates the bohemian art major scene, they begin to question their partnership. Now they don't have to just crack the case - they have to figure out if they can have a mature relationship. If these two overgrown adolescents can grow from freshmen into real men, college might be the best thing that ever happened to them.",https://ia.media-imdb.com/images/M/MV5BMTcwNzAxMDU1M15BMl5BanBnXkFtZTgwNDE2NTU1MTE@._V1_SX300.jpg,71,tt2294449,154295930
Teenage Mutant Ninja Turtles,2014,PG-13,101,Action,Megan Fox,FALSE,Will Arnett,TRUE,Darkness has settled over New York City as Shredder and his evil Foot Clan have an iron grip on everything from the police to the politicians. The future is grim until four unlikely outcast brothers rise from the sewers and discover their destiny as Teenage Mutant Ninja Turtles. The Turtles must work with fearless reporter April O'Neil and her cameraman Vern Fenwick to save the city and unravel Shredder's diabolical plan.,https://images-na.ssl-images-amazon.com/images/M/MV5BNjUzODQ5MDY5NV5BMl5BanBnXkFtZTgwOTc1NzcyMjE@._V1_SX300.jpg,31,tt1291150,163911409
Interstellar,2014,PG-13,169,Adventure,Matthew McConaughey,TRUE,Anne Hathaway,FALSE,"Earth's future has been riddled by disasters, famines, and droughts. There is only one way to ensure mankind's survival: Interstellar travel. A newly discovered wormhole in the far reaches of our solar system allows a team of astronauts to go where no man has gone before, a planet that may have the right environment to sustain human life.",https://images-na.ssl-images-amazon.com/images/M/MV5BZjdkOTU3MDktN2IxOS00OGEyLWFmMjktY2FiMmZkNWIyODZiXkEyXkFqcGdeQXVyMTMxODk2OTU@._V1_SX300.jpg,74,tt0816692,158737441
How to Train Your Dragon 2,2014,PG,102,Animation,Jay Baruchel,TRUE,Cate Blanchett,FALSE,"It's been five years since Hiccup and Toothless successfully united dragons and vikings on the island of Berk. While Astrid, Snotlout and the rest of the gang are challenging each other to dragon races (the island's new favorite contact sport), the now inseparable pair journey through the skies, charting unmapped territories and exploring new worlds. When one of their adventures leads to the discovery of a secret ice cave that is home to hundreds of new wild dragons and the mysterious Dragon Rider, the two friends find themselves at the center of a battle to protect the peace. Now, Hiccup and Toothless must unite to stand up for what they believe while recognizing that only together do they have the power to change the future of both men and dragons.",https://images-na.ssl-images-amazon.com/images/M/MV5BMzMwMTAwODczN15BMl5BanBnXkFtZTgwMDk2NDA4MTE@._V1_SX300.jpg,76,tt1646971,147065544
Gone Girl,2014,R,149,Crime,Ben Affleck,TRUE,Rosamund Pike,FALSE,"On the occasion of his fifth wedding anniversary, Nick Dunne reports that his wife, Amy, has gone missing. Under pressure from the police and a growing media frenzy, Nick's portrait of a blissful union begins to crumble. Soon his lies, deceits and strange behavior have everyone asking the same dark question: Did Nick Dunne kill his wife?",https://ia.media-imdb.com/images/M/MV5BYjgwY2E1N2QtNDJkMi00YzE4LThiYTItYWI5YmE4NWMzMGFhXkEyXkFqcGdeQXVyMjU3OTA4NzQ@._V1_SX300.jpg,79,tt2267998,167767189
Divergent,2014,PG-13,139,Adventure,Shailene Woodley,FALSE,Theo James,TRUE,"Set in a futuristic dystopia where society is divided into five factions that each represent a different virtue, teenagers have to decide if they want to stay in their faction or switch to another - for the rest of their lives. Tris Prior makes a choice that surprises everyone. Then Tris and her fellow faction-members have to live through a highly competitive initiation process to live out the choice they have made. They must undergo extreme physical and intense psychological tests, that transform them all. But Tris has a secret that she is Divergent, which means she doesn't fit into any one group. If anyone knew, it would mean a certain death. As she discovers a growing conflict that threatens to unravel her seemingly peaceful society, this secret might help her save the people she loves... or it might destroy her.",https://ia.media-imdb.com/images/M/MV5BMTYxMzYwODE4OV5BMl5BanBnXkFtZTgwNDE5MzE2MDE@._V1_SX300.jpg,48,tt1840309,129520735
Neighbors,2014,R,97,Comedy,Seth Rogen,TRUE,Rose Byrne,FALSE,"Kelly and Mac are settling down in a quiet neighborhood with their newborn child, until the frat brothers move into the house next door. Teddy is the President, and Pete is his right hand man, and they're quick to accept friendship when Kelly and Mac introduce themselves as the neighbors. Night after night, Mac asks Teddy to lower the fraternity's noise, even accepting the invitation to the party one evening. When Teddy goes back on his word to keep the partying down, Mac calls the police to deal with the problem. The police quickly blame Mac for their presence, and the war begins. As the family feuds with the frat brothers, things get hilariously dangerous and the fraternity ends up on thin ice with their college. After receiving their final warning and being placed on probation, Mac and Kelly pull a prank so ingenious that Teddy and Pete are forced to respond. All hell breaks loose, from Robert DeNiro parties to Christopher Mintz-Plasse having sex in the bushes, this comedy shows how things can go really wrong really quickly when a family and a frat house become neighbors.",https://ia.media-imdb.com/images/M/MV5BOTQ0OTkzODgyNF5BMl5BanBnXkFtZTgwOTA3OTE4MDE@._V1_SX300.jpg,68,tt2004420,134413041
Ride Along,2014,PG-13,99,Action,Ice Cube,TRUE,Kevin Hart,TRUE,"Ben must prove he is good enough to date cop James' sister. By doing this he goes on a ""Ride Along"" to show that he is not weak and he will do whatever it takes to get James' approval but along the way runs into a few obstacles that he has to overcome in a very funny way.",https://ia.media-imdb.com/images/M/MV5BNjU4NzYzOTY1MF5BMl5BanBnXkFtZTgwMTAyNTc1MDE@._V1_SX300.jpg,41,tt1408253,110374905
Rio 2,2014,G,101,Animation,Jesse Eisenberg,TRUE,Anne Hathaway,FALSE,"It's a jungle out there for Blu, Jewel and their three kids after they're hurtled Rio de Janeiro to the wilds of the Amazon. As Blu tries to fit in, he goes beak-to-beak with the vengeful Nigel, and meets the most fearsome adversary of all: his father-in-law.",https://images-na.ssl-images-amazon.com/images/M/MV5BMTgzMDczMDYzNl5BMl5BanBnXkFtZTgwMzk2MDIwMTE@._V1_SX300.jpg,49,tt2357291,113691800
Into the Woods,2014,PG,125,Adventure,Anna Kendrick,FALSE,Meryl Streep,FALSE,"Into the Woods is a modern twist on the beloved Brothers Grimm fairy tales in a musical format that follows the classic tales of Cinderella, Little Red Riding Hood, Jack and the Beanstalk, and Rapunzel-all tied together by an original story involving a baker and his wife, their wish to begin a family and their interaction with the witch who has put a curse on them.",https://ia.media-imdb.com/images/M/MV5BMTY4MzQ4OTY3NF5BMl5BanBnXkFtZTgwNjM5MDI3MjE@._V1_SX300.jpg,69,tt2180411,89789227
Lucy,2014,R,89,Action,Scarlett Johansson,FALSE,Morgan Freeman,TRUE,"It was supposed to be a simple job. All Lucy had to do was deliver a mysterious briefcase to Mr. Jang. But immediately Lucy is caught up in a nightmarish deal where she is captured and turned into a drug mule for a new and powerful synthetic drug. When the bag she is carrying inside of her stomach leaks, Lucy's body undergoes unimaginable changes that begins to unlock her mind's full potential. With her new-found powers, Lucy turns into a merciless warrior intent on getting back at her captors. She receives invaluable help from Professor Norman, the leading authority on the human mind, and French police captain Pierre Del Rio.",https://images-na.ssl-images-amazon.com/images/M/MV5BODcxMzY3ODY1NF5BMl5BanBnXkFtZTgwNzg1NDY4MTE@._V1_SX300.jpg,61,tt2872732,108521370
The Fault in Our Stars,2014,PG-13,126,Drama,Shailene Woodley,FALSE,Ansel Elgort,TRUE,"Hazel and Augustus are two teenagers who share an acerbic wit, a disdain for the conventional, and a love that sweeps them on a journey. Their relationship is all the more miraculous, given that Hazel's other constant companion is an oxygen tank, Gus jokes about his prosthetic leg, and they meet and fall in love at a cancer support group.",https://ia.media-imdb.com/images/M/MV5BMjA4NzkxNzc5Ml5BMl5BanBnXkFtZTgwNzQ3OTMxMTE@._V1_SX300.jpg,69,tt2582846,124872350
Unbroken,2014,PG-13,137,Biography,Jack O'Connell,TRUE,Miyavi,TRUE,"The life of Louis Zamperini, an Olympic athlete who joined the armed forces during the second world war. Only to be captured by the Japanese navy after a plane crash in the Pacific. During his capture, Louie must continue his fight by surviving through the war.",https://ia.media-imdb.com/images/M/MV5BMTY3ODg2OTgyOF5BMl5BanBnXkFtZTgwODk1OTAwMzE@._V1_SX300.jpg,59,tt1809398,70500647
Night at the Museum: Secret of the Tomb,2014,PG,98,Adventure,Ben Stiller,TRUE,Robin Williams,TRUE,"At the Museum of Natural History, there's a new exhibit being unveiled. Larry Daley, who manages the night exhibit where the exhibits come to life because of the Tablet of Ahkmenrah, is in charge of the presentation. But when the exhibits go awry, Larry finds himself in trouble. He learns the Tablet is corroding so he does some research and learns that Cecil, the former museum guard, was at the site when the Tablet was discovered. He tells Larry they were warned if they remove it could mean the end. Larry realizes it means the end of the magic. He talks to Ahkmenrah who says that he doesn't know anything. Only his father the Pharaoh knows the Tablet's secrets. He learns that the Pharaoh was sent to the London museum. So he convinces Dr. McPhee, the museum curator, to help send him to London. He takes Ahkmenrah with him but some of the others tag along, like Teddy Roosevelt, Attila, Octavius, and Jedediah.",https://images-na.ssl-images-amazon.com/images/M/MV5BMjI1MzM2ODEyMV5BMl5BanBnXkFtZTgwNTIzODAwMzE@._V1_SX300.jpg,47,tt2692250,81522782
Mr. Peabody & Sherman,2014,PG,92,Animation,Ty Burrell,TRUE,Max Charles,TRUE,"Mr. Peabody is a business titan, inventor, scientist, gourmand, two-time Olympic medalist and genius...who also happens to be a dog. Using his most ingenious invention, the WABAC machine, Mr. Peabody and his adopted boy Sherman hurtle back in time to experience world-changing events first-hand and interact with some of the greatest characters of all time. But when Sherman breaks the rules of time travel, our two heroes find themselves in a race to repair history and save the future, while Mr. Peabody may face his biggest challenge yet - being a parent.",https://ia.media-imdb.com/images/M/MV5BMTkxMzM0NzcwN15BMl5BanBnXkFtZTgwNzk1MjMzMTE@._V1_SX300.jpg,59,tt0864835,101784999
300: Rise of an Empire,2014,R,102,Action,Sullivan Stapleton,TRUE,Eva Green,FALSE,"After its victory over Leonidas' 300, the Persian Army under the command of Xerxes marches towards the major Greek city-states. The Democratic city of Athens, first on the path of Xerxes' army, bases its strength on its fleet, led by admiral Themistocles. Themistocles is forced to an unwilling alliance with the traditional rival of Athens, oligarchic Sparta whose might lies with its superior infantry troops. But Xerxes still reigns supreme in numbers over sea and land.",https://images-na.ssl-images-amazon.com/images/M/MV5BMTEwNTU2MjAwMDdeQTJeQWpwZ15BbWU3MDk2Njc2Njk@._V1_SX300.jpg,48,tt1253863,91024535
The Maze Runner,2014,PG-13,113,Action,Dylan O'Brien,TRUE,Kaya Scodelario,FALSE,"Awakening in an elevator, remembering nothing of his past, Thomas emerges into a world of about thirty teenage boys, all without past memories, who have learned to survive under their own set of rules in a completely enclosed environment, subsisting on their own agriculture and supplies. With a new boy arriving every thirty days, the group has been in ""The Glade"" for three years, trying to find a way to escape through the Maze that surrounds their living space (patrolled by cyborg monsters named 'Grievers'). They have begun to give up hope when a comatose girl arrives with a strange note, and their world begins to change with the boys dividing into two factions: those willing to risk their lives to escape and those wanting to hang onto what they've got and survive.",https://ia.media-imdb.com/images/M/MV5BMjUyNTA3MTAyM15BMl5BanBnXkFtZTgwOTEyMTkyMjE@._V1_SX300.jpg,57,tt1790864,98537272
The Equalizer,2014,R,132,Action,Denzel Washington,TRUE,Marton Csokas,TRUE,"In The Equalizer, Denzel Washington plays McCall, a man who believes he has put his mysterious past behind him and dedicated himself to beginning a new, quiet life. But when McCall meets Teri (Chloë Grace Moretz), a young girl under the control of ultra-violent Russian gangsters, he can't stand idly by - he has to help her. Armed with hidden skills that allow him to serve vengeance against anyone who would brutalize the helpless, McCall comes out of his self-imposed retirement and finds his desire for justice reawakened. If someone has a problem, if the odds are stacked against them, if they have nowhere else to turn, McCall will help. He is The Equalizer.",https://ia.media-imdb.com/images/M/MV5BMTQ2MzE2NTk0NF5BMl5BanBnXkFtZTgwOTM3NTk1MjE@._V1_SX300.jpg,57,tt0455944,85212969
Noah,2014,PG-13,138,Action,Russell Crowe,TRUE,Jennifer Connelly,FALSE,Noah unquestioningly follows the command of the world's creator to undertake a momentous mission before an apocalyptic flood cleanses the cursed lands of mankind.,https://images-na.ssl-images-amazon.com/images/M/MV5BNThkMjExYTEtMGYyNi00MWIzLThkNGQtMTM3YzBkZjFhZGI3XkEyXkFqcGdeQXVyMjQ2MTk1OTE@._V1_SX300.jpg,68,tt1959490,101160529
Edge of Tomorrow,2014,PG-13,113,Action,Tom Cruise,TRUE,Emily Blunt,FALSE,"An alien race has hit the Earth in an unrelenting assault, unbeatable by any military unit in the world. Major William Cage (Cruise) is an officer who has never seen a day of combat when he is unceremoniously dropped into what amounts to a suicide mission. Killed within minutes, Cage now finds himself inexplicably thrown into a time loop-forcing him to live out the same brutal combat over and over, fighting and dying again...and again. But with each battle, Cage becomes able to engage the adversaries with increasing skill, alongside Special Forces warrior Rita Vrataski (Blunt). And, as Cage and Vrataski take the fight to the aliens, each repeated encounter gets them one step closer to defeating the enemy!",https://ia.media-imdb.com/images/M/MV5BMTc5OTk4MTM3M15BMl5BanBnXkFtZTgwODcxNjg3MDE@._V1_SX300.jpg,71,tt1631867,77121429
Non-Stop,2014,PG-13,106,Action,Liam Neeson,TRUE,Julianne Moore,FALSE,"Bill Marks, a former cop dealing with his daughter's death by drinking, is now a federal air marshal. While on a flight from New York to London, Marks gets a text telling him that unless 150 million dollars is transferred to an offshore account, someone will die every 20 minutes. Can he find the terrorist in time and save everyone?",https://images-na.ssl-images-amazon.com/images/M/MV5BOTI3NzcxMjkzMl5BMl5BanBnXkFtZTgwMDY0NTQ0MDE@._V1_SX300.jpg,56,tt2024469,80432029
