Title,Year,Rated,Runtime,Genre,Lead_1,Lead_1_Male,Lead_2,Lead_2_Male,Plot,Poster,Metascore,imdbID,BoxOffice
Star Wars: The Last Jedi,2017,PG-13,152,Action,Daisy Ridley,FALSE,John Boyega,TRUE,"Rey develops her newly discovered abilities with the guidance of Luke Skywalker, who is unsettled by the strength of her powers. Meanwhile, the Resistance prepares for battle with the First Order.",https://ia.media-imdb.com/images/M/MV5BMjQ1MzcxNjg4N15BMl5BanBnXkFtZTgwNzgwMjY4MzI@._V1_SX300.jpg,85,tt2527336,619117636
Beauty and the Beast,2017,PG,129,Family,Emma Watson,FALSE,Dan Stevens,TRUE,"Disney's animated classic takes on a new form, with a widened mythology and an all-star cast. A young prince, imprisoned in the form of a beast, can be freed only by true love. What may be his only opportunity arrives when he meets Belle, the only human girl to ever visit the castle since it was enchanted.",https://ia.media-imdb.com/images/M/MV5BMTUwNjUxMTM4NV5BMl5BanBnXkFtZTgwODExMDQzMTI@._V1_SX300.jpg,65,tt2771200,503974884
Wonder Woman,2017,PG-13,141,Action,Gal Gadot,FALSE,Chris Pine,TRUE,"Diana, princess of the Amazons, trained to be an unconquerable warrior. Raised on a sheltered island paradise, when a pilot crashes on their shores and tells of a massive conflict raging in the outside world, Diana leaves her home, convinced she can stop the threat. Fighting alongside man in a war to end all wars, Diana will discover her full powers and her true destiny.",https://images-na.ssl-images-amazon.com/images/M/MV5BNDFmZjgyMTEtYTk5MC00NmY0LWJhZjktOWY2MzI5YjkzODNlXkEyXkFqcGdeQXVyMDA4NzMyOA@@._V1_SX300.jpg,76,tt0451279,412400625
Jumanji: Welcome to the Jungle,2017,PG-13,119,Action,Dwayne Johnson,TRUE,Karen Gillan,FALSE,"In a brand new Jumanji adventure, four high school kids discover an old video game console and are drawn into the game's jungle setting, literally becoming the adult avatars they chose. What they discover is that you don't just play Jumanji - you must survive it. To beat the game and return to the real world, they'll have to go on the most dangerous adventure of their lives, discover what Alan Parrish left 20 years ago, and change the way they think about themselves - or they'll be stuck in the game forever, to be played by others without break.",https://ia.media-imdb.com/images/M/MV5BODQ0NDhjYWItYTMxZi00NTk2LWIzNDEtOWZiYWYxZjc2MTgxXkEyXkFqcGdeQXVyMTQxNzMzNDI@._V1_SX300.jpg,58,tt2283362,393201353
Guardians of the Galaxy Vol. 2,2017,PG-13,136,Action,Chris Pratt,TRUE,Zoe Saldana,FALSE,"After saving Xandar from Ronan's wrath, the Guardians are now recognized as heroes. Now the team must help their leader Star Lord (Chris Pratt) uncover the truth behind his true heritage. Along the way, old foes turn to allies and betrayal is blooming. And the Guardians find that they are up against a devastating new menace who is out to rule the galaxy.",https://ia.media-imdb.com/images/M/MV5BMTg2MzI1MTg3OF5BMl5BanBnXkFtZTgwNTU3NDA2MTI@._V1_SX300.jpg,67,tt3896198,389804217
Spider-Man: Homecoming,2017,PG-13,133,Action,Tom Holland,TRUE,Michael Keaton,TRUE,"Thrilled by his experience with the Avengers, Peter returns home, where he lives with his Aunt May, under the watchful eye of his new mentor Tony Stark, Peter tries to fall back into his normal daily routine - distracted by thoughts of proving himself to be more than just your friendly neighborhood Spider-Man - but when the Vulture emerges as a new villain, everything that Peter holds most important will be threatened.",https://ia.media-imdb.com/images/M/MV5BNTk4ODQ1MzgzNl5BMl5BanBnXkFtZTgwMTMyMzM4MTI@._V1_SX300.jpg,73,tt2250912,334166825
It,2017,R,135,Drama,Bill Skarsgård,TRUE,Jaeden Lieberher,TRUE,"In the Town of Derry, the local kids are disappearing one by one, leaving behind bloody remains. In a place known as 'The Barrens', a group of seven kids are united by their horrifying and strange encounters with an evil clown and their determination to kill It.",https://ia.media-imdb.com/images/M/MV5BZDVkZmI0YzAtNzdjYi00ZjhhLWE1ODEtMWMzMWMzNDA0NmQ4XkEyXkFqcGdeQXVyNzYzODM3Mzg@._V1_SX300.jpg,69,tt1396484,326898358
Thor: Ragnarok,2017,PG-13,130,Action,Chris Hemsworth,TRUE,Tom Hiddleston,TRUE,"Thor is imprisoned on the other side of the universe and finds himself in a race against time to get back to Asgard to stop Ragnarok, the destruction of his homeworld and the end of Asgardian civilization, at the hands of an all-powerful new threat, the ruthless Hela.",https://ia.media-imdb.com/images/M/MV5BMjMyNDkzMzI1OF5BMl5BanBnXkFtZTgwODcxODg5MjI@._V1_SX300.jpg,74,tt3501632,314971245
Despicable Me 3,2017,PG,89,Animation,Steve Carell,TRUE,Kristen Wiig,FALSE,"After he is fired from the Anti-Villain League for failing to take down the latest bad guy to threaten humanity, Gru finds himself in the midst of a major identity crisis. But when a mysterious stranger shows up to inform Gru that he has a long-lost twin brother-a brother who desperately wishes to follow in his twin's despicable footsteps-one former super-villain will rediscover just how good it feels to be bad.",https://ia.media-imdb.com/images/M/MV5BNjUyNzQ2MTg3Ml5BMl5BanBnXkFtZTgwNzE4NDM3MTI@._V1_SX300.jpg,49,tt3469046,264194540
Justice League,2017,PG-13,120,Action,Ben Affleck,TRUE,Gal Gadot,FALSE,"Fueled by his restored faith in humanity and inspired by Superman's selfless act, Bruce Wayne enlists the help of his newfound ally, Diana Prince, to face an even greater enemy. Together, Batman and Wonder Woman work quickly to find and recruit a team of metahumans to stand against this newly awakened threat. But despite the formation of this unprecedented league of heroes-Batman, Wonder Woman, Aquaman, Cyborg and The Flash-it may already be too late to save the planet from an assault of catastrophic proportions.",https://images-na.ssl-images-amazon.com/images/M/MV5BYWVhZjZkYTItOGIwYS00NmRkLWJlYjctMWM0ZjFmMDU4ZjEzXkEyXkFqcGdeQXVyMTMxODk2OTU@._V1_SX300.jpg,45,tt0974015,227032490
Logan,2017,R,137,Action,Hugh Jackman,TRUE,Patrick Stewart,TRUE,"In 2029 the mutant population has shrunken significantly and the X-Men have disbanded. Logan, whose power to self-heal is dwindling, has surrendered himself to alcohol and now earns a living as a chauffeur. He takes care of the ailing old Professor X whom he keeps hidden away. One day, a female stranger asks Logan to drive a girl named Laura to the Canadian border. At first he refuses, but the Professor has been waiting for a long time for her to appear. Laura possesses an extraordinary fighting prowess and is in many ways like Wolverine. She is pursued by sinister figures working for a powerful corporation; this is because her DNA contains the secret that connects her to Logan. A relentless pursuit begins - In this third cinematic outing featuring the Marvel comic book character Wolverine we see the superheroes beset by everyday problems. They are aging, ailing and struggling to survive financially. A decrepit Logan is forced to ask himself if he can or even wants to put his remaining powers to good use. It would appear that in the near-future, the times in which they were able put the world to rights with razor sharp claws and telepathic powers are now over.",https://images-na.ssl-images-amazon.com/images/M/MV5BMjQwODQwNTg4OV5BMl5BanBnXkFtZTgwMTk4MTAzMjI@._V1_SX300.jpg,77,tt3315342,226276809
The Fate of the Furious,2017,PG-13,136,Action,Vin Diesel,TRUE,Jason Statham,TRUE,"Now that Dom and Letty are on their honeymoon and Brian and Mia have retired from the game-and the rest of the crew has been exonerated-the globetrotting team has found a semblance of a normal life. But when a mysterious woman seduces Dom into the world of crime he can't seem to escape and a betrayal of those closest to him, they will face trials that will test them as never before. From the shores of Cuba and the streets of New York City to the icy plains off the arctic Barents Sea, the elite force will crisscross the globe to stop an anarchist from unleashing chaos on the world's stage... and to bring home the man who made them a family.",https://ia.media-imdb.com/images/M/MV5BMjMxODI2NDM5Nl5BMl5BanBnXkFtZTgwNjgzOTk1MTI@._V1_SX300.jpg,56,tt4630562,225697400
Coco,2017,PG,105,Animation,Anthony Gonzalez,TRUE,Gael García Bernal,TRUE,"Despite his family's baffling generations-old ban on music, Miguel (voice of newcomer Anthony Gonzalez) dreams of becoming an accomplished musician like his idol, Ernesto de la Cruz (voice of Benjamin Bratt). Desperate to prove his talent, Miguel finds himself in the stunning and colorful Land of the Dead following a mysterious chain of events. Along the way, he meets charming trickster Hector (voice of Gael García Bernal), and together, they set off on an extraordinary journey to unlock the real story behind Miguel's family history.",https://ia.media-imdb.com/images/M/MV5BYjQ5NjM0Y2YtNjZkNC00ZDhkLWJjMWItN2QyNzFkMDE3ZjAxXkEyXkFqcGdeQXVyODIxMzk5NjA@._V1_SX300.jpg,81,tt2380307,208487719
Dunkirk,2017,PG-13,106,Action,Fionn Whitehead,TRUE,Barry Keoghan,TRUE,"Evacuation of Allied soldiers from Belgium, the British Empire, and France, who were cut off and surrounded by the German army from the beaches and harbor of Dunkirk, France, between May 26- June 04, 1940, during Battle of France in World War II.",https://ia.media-imdb.com/images/M/MV5BN2YyZjQ0NTEtNzU5MS00NGZkLTg0MTEtYzJmMWY3MWRhZjM2XkEyXkFqcGdeQXVyMDA4NzMyOA@@._V1_SX300.jpg,94,tt5013056,188042171
Get Out,2017,R,104,Horror,Daniel Kaluuya,TRUE,Allison Williams,FALSE,"Chris and his girlfriend Rose go upstate to visit her parent's for the weekend. At first, Chris reads the family's overly accommodating behavior as nervous attempts to deal with their daughter's interracial relationship, but as the weekend progresses, a series of increasingly disturbing discoveries lead him to a truth that he never could have imagined.",https://ia.media-imdb.com/images/M/MV5BMjUxMDQwNjcyNl5BMl5BanBnXkFtZTgwNzcwMzc0MTI@._V1_SX300.jpg,84,tt5052448,175428355
The LEGO Batman Movie,2017,PG,104,Animation,Will Arnett,TRUE,Michael Cera,TRUE,"There are big changes brewing in Gotham City, and if he wants to save the city from The Joker's hostile takeover, Batman may have to drop the lone vigilante thing, try to work with others and maybe, just maybe, learn to lighten up.",https://ia.media-imdb.com/images/M/MV5BMTcyNTEyOTY0M15BMl5BanBnXkFtZTgwOTAyNzU3MDI@._V1_SX300.jpg,75,tt4116284,175686290
The Boss Baby,2017,PG,97,Animation,Alec Baldwin,TRUE,Steve Buscemi,TRUE,"Seven-year-old Tim Templeton has always been a boy of an overactive imagination, and for the past seven years, life was all peaches for him, getting all the love and affection from his caring parents. However, life will never be the same and Tim won't be the centre of attention anymore as the arrival of an improbable new brother named Boss Baby, dressed in a black suit complete with a tie and a briefcase, will shortly rob him of all love, as he takes over the whole Templetons' house. Nevertheless, although this may be true, soon, Tim and the new Boss in a diaper will need to put differences aside and join forces, as a sneaky scheme involving the head of Puppy Co. threatens to tilt the balance of power towards their insidiously adorable furry antagonists, not to mention that the next Pet Convention is in only two days.. Brothers, hurry up.",https://ia.media-imdb.com/images/M/MV5BMTg5MzUxNzgxNV5BMl5BanBnXkFtZTgwMTM2NzQ3MjI@._V1_SX300.jpg,50,tt3874544,174996080
The Greatest Showman,2017,PG,105,Biography,Hugh Jackman,TRUE,Michelle Williams,FALSE,"Celebrates the birth of show business, and tells of a visionary who rose from nothing to create a spectacle that became a worldwide sensation.",https://ia.media-imdb.com/images/M/MV5BYjQ0ZWJkYjMtYjJmYS00MjJiLTg3NTYtMmIzN2E2Y2YwZmUyXkEyXkFqcGdeQXVyNjk5NDA3OTk@._V1_SX300.jpg,48,tt1485796,164616443
Pirates of the Caribbean: Dead Men Tell No Tales,2017,PG-13,129,Action,Johnny Depp,TRUE,Geoffrey Rush,TRUE,"Captain Jack Sparrow finds the winds of ill-fortune blowing even more strongly when deadly ghost pirates led by his old nemesis, the terrifying Captain Salazar, escape from the Devil's Triangle, determined to kill every pirate at sea...including him. Captain Jack's only hope of survival lies in seeking out the legendary Trident of Poseidon, a powerful artifact that bestows upon its possessor total control over the seas.",https://ia.media-imdb.com/images/M/MV5BMTYyMTcxNzc5M15BMl5BanBnXkFtZTgwOTg2ODE2MTI@._V1_SX300.jpg,39,tt1790809,172537139
Kong: Skull Island,2017,PG-13,118,Action,Tom Hiddleston,TRUE,Samuel L. Jackson,TRUE,"A washed up monster chaser convinces the U.S. Government to fund a trip to an unexplored island in the South Pacific. Under the guise of geological research, the team travels to ""Skull Island"". Upon arrival, the group discover that their mission may be complicated by the wildlife which inhabits the island. The beautiful vistas and deadly creatures create a visually stunning experience that is sure to keep your attention.",https://ia.media-imdb.com/images/M/MV5BMTUwMzI5ODEwNF5BMl5BanBnXkFtZTgwNjAzNjI2MDI@._V1_SX300.jpg,62,tt3731562,167986460
Cars 3,2017,G,102,Animation,Owen Wilson,TRUE,Cristela Alonzo,FALSE,"Blindsided by a new generation of blazing-fast racers, the legendary Lightning McQueen is suddenly pushed out of the sport he loves. To get back in the game, he will need the help of an eager young race technician with her own plan to win, inspiration from the late Fabulous Hudson Hornet, and a few unexpected turns. Proving that #95 isn't through yet will test the heart of a champion on Piston Cup Racing's biggest stage!",https://ia.media-imdb.com/images/M/MV5BMTc0NzU2OTYyN15BMl5BanBnXkFtZTgwMTkwOTg2MTI@._V1_SX300.jpg,59,tt3606752,152603003
War for the Planet of the Apes,2017,PG-13,140,Action,Andy Serkis,TRUE,Woody Harrelson,TRUE,"Caesar and his apes are forced into a deadly conflict with an army of humans led by a ruthless Colonel. After the apes suffer unimaginable losses, Caesar wrestles with his darker instincts and begins his own mythic quest to avenge his kind. As the journey finally brings them face to face, Caesar and the Colonel are pitted against each other in an epic battle that will determine the fate of both their species and the future of the planet.",https://ia.media-imdb.com/images/M/MV5BNDNmYTQzMDEtMmY0MS00OTNjLTk4MjItMDZhMzkzOGI3MzA0XkEyXkFqcGdeQXVyNjk5NDA3OTk@._V1_SX300.jpg,82,tt3450958,146872826
Split,2017,PG-13,117,Horror,James McAvoy,TRUE,Anya Taylor-Joy,FALSE,Three girls are kidnapped by a man with a diagnosed 23 distinct personalities. They must try to escape before the apparent emergence of a frightful new 24th.,"https://ia.media-imdb.com/images/M/MV5BZTJiNGM2NjItNDRiYy00ZjY0LTgwNTItZDBmZGRlODQ4YThkL2ltYWdlXkEyXkFqcGdeQXVyMjY5ODI4NDk@._V1_UX182_CR0,0,182,268_AL_.jpg",62,tt4972582,138291365
Wonder,2017,PG,113,Drama,Jacob Tremblay,TRUE,Owen Wilson,TRUE,"Based on the New York Times bestseller, WONDER tells the incredibly inspiring and heartwarming story of August Pullman. Born with facial differences that, up until now, have prevented him from going to a mainstream school, Auggie becomes the most unlikely of heroes when he enters the local fifth grade. As his family, his new classmates, and the larger community all struggle to discover their compassion and acceptance, Auggie's extraordinary journey will unite them all and prove you can't blend in when you were born to stand out.",https://ia.media-imdb.com/images/M/MV5BYjFhOWY0OTgtNDkzMC00YWJkLTk1NGEtYWUxNjhmMmQ5ZjYyXkEyXkFqcGdeQXVyMjMxOTE0ODA@._V1_SX300.jpg,66,tt2543472,132090170
Transformers: The Last Knight,2017,PG-13,154,Action,Mark Wahlberg,TRUE,Anthony Hopkins,TRUE,"Optimus Prime finds his dead home planet, Cybertron, in which he comes to find he was responsible for its destruction. He finds a way to bring Cybertron back to life, but in order to do so, Optimus needs to find an artifact that is on Earth.",https://ia.media-imdb.com/images/M/MV5BMTk3OTI3MDk4N15BMl5BanBnXkFtZTgwNDg2ODIyMjI@._V1_SX300.jpg,27,tt3371366,130104634
Girls Trip,2017,R,122,Comedy,Regina Hall,FALSE,Queen Latifah,FALSE,"When four lifelong friends travel to New Orleans for the annual Essence Festival, sisterhoods are rekindled, wild sides are rediscovered, and there's enough dancing, drinking, brawling, and romancing to make the Big Easy blush.",https://ia.media-imdb.com/images/M/MV5BMjMwNTEzODUwMV5BMl5BanBnXkFtZTgwNjE5NjA5MjI@._V1_SX300.jpg,71,tt3564472,115088305
Fifty Shades Darker,2017,R,118,Drama,Dakota Johnson,FALSE,Jamie Dornan,TRUE,"Christian and Ana decide to rekindle their relationship, except this time there are no more rules or punishments. As they begin to get used to their newfound relationship, Christian's past begins to haunt Ana as Christian struggles with his innermost thoughts.",https://ia.media-imdb.com/images/M/MV5BMTQ5NTk0Njg2N15BMl5BanBnXkFtZTgwNzk5Nzk3MDI@._V1_SX300.jpg,33,tt4465564,114376885
Baby Driver,2017,R,112,Action,Ansel Elgort,TRUE,Jon Bernthal,TRUE,"Baby is a young and partially hearing impaired getaway driver who can make any wild move while in motion with the right track playing. It's a critical talent he needs to survive his indentured servitude to the crime boss, Doc, who values his role in his meticulously planned robberies. However, just when Baby thinks he is finally free and clear to have his own life with his new girlfriend, Deborah, Doc coerces him back for another job. Now saddled with a crew of thugs too violently unstable to keep to Doc's plans, Baby finds himself and everything he cares for in terrible danger. To survive and escape the coming maelstrom, it will take all of Baby's skill, wits and daring, but even on the best track, can he make it when life is forcing him to face the music?",https://ia.media-imdb.com/images/M/MV5BMjM3MjQ1MzkxNl5BMl5BanBnXkFtZTgwODk1ODgyMjI@._V1_SX300.jpg,86,tt3890160,107770367
Pitch Perfect 3,2017,PG-13,93,Comedy,Anna Kendrick,FALSE,Rebel Wilson,FALSE,"After the highs of winning the World Championships, the Bellas find themselves split apart and discovering there aren't job prospects for making music with your mouth. But when they get the chance to reunite for an overseas USO tour, this group of awesome nerds will come together to make some music, and some questionable decisions, one last time.",https://ia.media-imdb.com/images/M/MV5BMTU5NDI1MjkwMF5BMl5BanBnXkFtZTgwNjIxNTY2MzI@._V1_SX300.jpg,40,tt4765284,104880310
Daddy's Home 2,2017,PG-13,100,Comedy,Will Ferrell,TRUE,Mark Wahlberg,TRUE,"Having finally gotten used to each other's existence, Brad and Dusty must now deal with their intrusive fathers during the holidays.",https://images-na.ssl-images-amazon.com/images/M/MV5BNDA4Nzc1OTg2OV5BMl5BanBnXkFtZTgwODE3ODgwNDI@._V1_SX300.jpg,30,tt5657846,102934995
Murder on the Orient Express,2017,PG-13,114,Crime,Kenneth Branagh,TRUE,Penélope Cruz,FALSE,"When a murder occurs on the train he's travelling on, celebrated detective Hercule Poirot is recruited to solve the case.",https://ia.media-imdb.com/images/M/MV5BNGFmM2NmYjYtMjAwNy00ZDkzLWI3ZWMtOGZhOTRhYzQwMTA0XkEyXkFqcGdeQXVyNzU2MzMyNTI@._V1_SX300.jpg,52,tt3402236,101555644
Annabelle: Creation,2017,R,109,Horror,Anthony LaPaglia,TRUE,Samara Lee,FALSE,"12 years after the tragic death of their little girl, a dollmaker and his wife welcome a nun and several girls from a shuttered orphanage into their home, where they soon become the target of the dollmaker's possessed creation, Annabelle.",https://images-na.ssl-images-amazon.com/images/M/MV5BMjA1MzIwMjMxNF5BMl5BanBnXkFtZTgwMDQ3NTc2MjI@._V1_SX300.jpg,62,tt5140878,101788793
Kingsman: The Golden Circle,2017,R,141,Action,Taron Egerton,TRUE,Colin Firth,TRUE,"When the Kingsman headquarters are destroyed and the world is held hostage, their journey leads them to the discovery of an allied spy organization in the US called Statesman, dating back to the day they were both founded. In a new adventure that tests their agents' strength and wits to the limit, these two elite secret organizations band together to defeat a ruthless common enemy, in order to save the world, something that's becoming a bit of a habit for Eggsy...",https://ia.media-imdb.com/images/M/MV5BMjQ3OTgzMzY4NF5BMl5BanBnXkFtZTgwOTc4OTQyMzI@._V1_SX300.jpg,44,tt4649466,99733121
Blade Runner 2049,2017,R,164,Drama,Harrison Ford,TRUE,Ryan Gosling,TRUE,"Thirty years after the events of the first film, a new blade runner, LAPD Officer K (Ryan Gosling), unearths a long-buried secret that has the potential to plunge what's left of society into chaos. K's discovery leads him on a quest to find Rick Deckard (Harrison Ford), a former LAPD blade runner who has been missing for 30 years.",https://ia.media-imdb.com/images/M/MV5BNzA1Njg4NzYxOV5BMl5BanBnXkFtZTgwODk5NjU3MzI@._V1_SX300.jpg,81,tt1856101,91800042
John Wick: Chapter Two,2017,R,122,Action,Keanu Reeves,TRUE,Riccardo Scamarcio,TRUE,"After returning to the criminal underworld to repay a debt, John Wick discovers that a large bounty has been put on his life.","https://ia.media-imdb.com/images/M/MV5BMjE2NDkxNTY2M15BMl5BanBnXkFtZTgwMDc2NzE0MTI@._V1_UX182_CR0,0,182,268_AL_.jpg",75,tt4425200,92029184
The Emoji Movie,2017,PG,86,Animation,T.J. Miller,TRUE,James Corden,TRUE,"The Emoji Movie unlocks the never-before-seen secret world inside your smartphone. Hidden within the messaging app is Textopolis, a bustling city where all your favorite emojis live, hoping to be selected by the phone's user. In this world, each emoji has only one facial expression - except for Gene, an exuberant emoji who was born without a filter and is bursting with multiple expressions. Determined to become ""normal"" like the other emojis, Gene enlists the help of his handy best friend Hi-5 and the notorious code breaker emoji Jailbreak. Together, they embark on an epic ""app-venture"" through the apps on the phone, each its own wild and fun world, to find the Code that will fix Gene. But when a greater danger threatens the phone, the fate of all emojis depends on these three unlikely friends who must save their world before it's deleted forever.",https://ia.media-imdb.com/images/M/MV5BMTkzMzM3OTM2Ml5BMl5BanBnXkFtZTgwMDM0NDU3MjI@._V1_SX300.jpg,12,tt4877122,86053485
Power Rangers,2017,PG-13,124,Action,Dacre Montgomery,TRUE,Naomi Scott,FALSE,"High school outcasts stumble upon an old alien ship, where they acquire superpowers and are dubbed the Power Rangers. Learning that an old enemy of the previous generation has returned to exact vegenance, the group must harness their powers and use them to work together and save the world.",https://ia.media-imdb.com/images/M/MV5BMTU1MTkxNzc5NF5BMl5BanBnXkFtZTgwOTM2Mzk3MTI@._V1_SX300.jpg,44,tt3717490,85275488
Ferdinand,2017,PG,108,Animation,John Cena,TRUE,Kate McKinnon,FALSE,"Ferdinand, is a a giant bull with a big heart. he is mistaken for a dangerous beast and is captured and torn from his home and family. Determined to return to his family, he rallies a misfit team for the ultimate adventure. Set in Spain, Ferdinand proves you can't judge a bull by its cover.",https://ia.media-imdb.com/images/M/MV5BOTIwMDI0NjQ4OF5BMl5BanBnXkFtZTgwNjU0MzAyNDM@._V1_SX300.jpg,58,tt3411444,70466891
The Post,2017,PG-13,116,Biography,Meryl Streep,FALSE,Tom Hanks,TRUE,A cover-up that spanned four U.S. Presidents pushed the country's first female newspaper publisher and a hard-driving editor to join an unprecedented battle between the press and the government.,https://ia.media-imdb.com/images/M/MV5BMjQyMjEwOTIwNV5BMl5BanBnXkFtZTgwOTkzNTMxNDM@._V1_SX300.jpg,83,tt6294822,80369969
The Mummy,2017,PG-13,110,Action,Tom Cruise,TRUE,Sofia Boutella,FALSE,"Though safely entombed in a crypt deep beneath the unforgiving desert, an ancient princess, whose destiny was unjustly taken from her, is awakened in our current day bringing with her malevolence grown over millennia, and terrors that defy human comprehension.",https://ia.media-imdb.com/images/M/MV5BODg1NTIxMzEtM2NmMi00MDQ2LWE5YjYtZTgxYmNhZTQxYWIzXkEyXkFqcGdeQXVyNDYzODU1ODM@._V1_SX300.jpg,34,tt2345759,80072590
The Hitman's Bodyguard,2017,R,118,Action,Ryan Reynolds,TRUE,Samuel L. Jackson,TRUE,"The world's top bodyguard gets a new client, a hit man who must testify at the International Criminal Court. They must put their differences aside and work together to make it to the trial on time.",https://ia.media-imdb.com/images/M/MV5BMjQ5NjA2NDg1MV5BMl5BanBnXkFtZTgwMDAzNDc4MjI@._V1_SX300.jpg,47,tt1959563,75020039
Alien: Covenant,2017,R,122,Horror,Michael Fassbender,TRUE,Katherine Waterston,FALSE,"The crew of the colony ship Covenant, bound for a remote planet on the far side of the galaxy, discovers what they think is an uncharted paradise, but is actually a dark, dangerous world. When they uncover a threat beyond their imagination, they must attempt a harrowing escape",https://images-na.ssl-images-amazon.com/images/M/MV5BNzI5MzM3MzkxNF5BMl5BanBnXkFtZTgwOTkyMjI4MTI@._V1_SX300.jpg,65,tt2316204,74255908
Captain Underpants: The First Epic Movie,2017,PG,89,Animation,Kevin Hart,TRUE,Thomas Middleditch,TRUE,"2 overly imaginative pranksters named George and Harold hypnotize their principal into thinking he's a ridiculously enthusiastic, incredibly dimwitted superhero named Captain Underpants.",https://ia.media-imdb.com/images/M/MV5BMjE1MzM2NzgzNV5BMl5BanBnXkFtZTgwODU3NTI0MTI@._V1_SX300.jpg,69,tt2091256,73895861
A Bad Moms Christmas,2017,R,104,Adventure,Mila Kunis,FALSE,Kristen Bell,FALSE,"As their own mothers drop in unexpectedly, our three under-appreciated and over-burdened moms rebel against the challenges and expectations of the Super Bowl for mothers: Christmas.",https://ia.media-imdb.com/images/M/MV5BMTUwNTA4MDMxNl5BMl5BanBnXkFtZTgwMjE4NjQ0MzI@._V1_SX300.jpg,42,tt6359956,72080547
