Title,Year,Rated,Runtime,Genre,Lead_1,Lead_1_Male,Lead_2,Lead_2_Male,Plot,Poster,Metascore,imdbID,BoxOffice
A Dog's Purpose,2017,PG,100,Adventure,Josh Gad,TRUE,Dennis Quaid,TRUE,A dog looks to discover his purpose in life over the course of several lifetimes and owners.,https://ia.media-imdb.com/images/M/MV5BNDQ4NjkxNzgzN15BMl5BanBnXkFtZTgwMjAzODQ4OTE@._V1_SX300.jpg,43,tt1753383,64304940
The Shape of Water,2017,R,123,Adventure,Sally Hawkins,FALSE,Octavia Spencer,FALSE,"At a top secret research facility in the 1960s, a lonely janitor forms a unique relationship with an amphibious creature that is being held in captivity.",https://ia.media-imdb.com/images/M/MV5BNGNiNWQ5M2MtNGI0OC00MDA2LWI5NzEtMmZiYjVjMDEyOWYzXkEyXkFqcGdeQXVyMjM4NTM5NDY@._V1_SX300.jpg,87,tt5580390,57393976
The Lego Ninjago Movie,2017,PG,101,Animation,Jackie Chan,TRUE,Dave Franco,TRUE,"Six young ninjas Lloyd, Jay, Kai, Cole, Zane and Nya are tasked with defending their island home, called Ninjago. By night, they're gifted warriors, using their skills and awesome fleet of vehicles to fight villains and monsters. By day, they're ordinary teens struggling against their greatest enemy: high school.",https://ia.media-imdb.com/images/M/MV5BNDI3MDljMTQtYzBiYS00NDk2LTlhYzUtYmM0NWIyMmZkMDZkXkEyXkFqcGdeQXVyNjk5NDA3OTk@._V1_SX300.jpg,55,tt3014284,58938889
Baywatch,2017,R,116,Action,Dwayne Johnson,TRUE,Zac Efron,TRUE,"In sun-kissed Emerald Bay, the vigorous Lieutenant Mitch Buchannon and Baywatch, his elite team of hand-picked and perfectly tanned lifeguards, protect the bay, keeping both sunbathers and beach lovers safe. However, this summer, two new eager trainees will join the demanding life-saving program, as well as an insubordinate former Olympic swimmer, who are all called to prove their worth on the lifeguard towers just on time when a new synthetic street drug begins to infest the Emerald Bay: the flakka. Without a doubt, this calls for some serious undercover teamwork action, as the badgeless heroes in spandex comb the beach for shady newcomers and nefarious entrepreneurs with hidden agendas of their own. Can Mitch's band save the bay?",https://ia.media-imdb.com/images/M/MV5BNTA4MjQ0ODQzNF5BMl5BanBnXkFtZTgwNzA5NjYzMjI@._V1_SX300.jpg,37,tt1469304,58009442
The Shack,2017,PG-13,132,Drama,Sam Worthington,TRUE,Octavia Spencer,FALSE,"After the abduction and presumed death of Mackenzie Allen Phillips' youngest daughter, Missy, Mack receives a letter and suspects it is from God, asking him to return to The Shack where Missy may have been murdered. After contemplating it, he leaves his home to go to The Shack for the first time since Missy's abduction and an encounter that will change his life forever.",https://ia.media-imdb.com/images/M/MV5BMjI3MDMxNzcxNl5BMl5BanBnXkFtZTgwODc4MzkwOTE@._V1_SX300.jpg,32,tt2872518,57330873
Darkest Hour,2017,PG-13,125,Biography,Gary Oldman,TRUE,Lily James,FALSE,"Within days of becoming Prime Minister of Great Britain, Winston Churchill (Gary Oldman) must face one of his most turbulent and defining trials: exploring a negotiated peace treaty with Nazi Germany, or standing firm to fight for the ideals, liberty and freedom of a nation. As the unstoppable Nazi forces roll across Western Europe and the threat of invasion is imminent, and with an unprepared public, a skeptical King, and his own party plotting against him, Churchill must withstand his darkest hour, rally a nation, and attempt to change the course of world history.",https://ia.media-imdb.com/images/M/MV5BNTU4MjMwOTgyMV5BMl5BanBnXkFtZTgwODQzNjY2NDM@._V1_SX300.jpg,75,tt4555426,28086332
